id,question                                                  ,answer1          ,answer2          ,answer3             ,rightAnswer
1 ,Кто написал первую компьютерную программу?                ,1 Том Килбурн    ,2 Ада Лавлейс    ,3 Билл Гейтс        ,2 Ада Лавлейс
2 ,На каком языке написана эта программа?                    ,1 Русский        ,2 Английский     ,3 Java              ,3 Java
3 ,С использованием какого фреймворка написана эта программа?,1 Spring         ,2 String         ,3 Swing             ,1 Spring
4 ,Чья шутка использованна в предыдущем вопросе?             ,1 Кирилл Толкачев,2 Евгений Борисов,3 Джордж Бернард Шоу,2 Eвгений Борисов
5 ,Оцените пройденный тест.                                  ,1 Неплохо        ,2 Отлично        ,3 Можно лучше       ,Спасибо за оценку